objectid,parentid,title,interviewee,interviewer,creator,date,archival date,description,subject,location,latitude,longitude,include_map,source,identifier,type,format,language,rights,rightsstatement,display_template,object_location,image_small,image_thumb,pdf,bio
rutherford,,Interview with Lucille Johnson Rutherford,,Claude Sitton; History Museum of Burke County,History Museum of Burke County,2015-08-23,,"Lucille Johnson Rutherford grew up in Glen Alpine and went to MacAlpine Elementary School. Johnson was one of the Seven Mothers who called themselves the West Concord Mothers. Other mothers include: Ms. Laura Thomas, Ms. Willett Chambers, Mildred Largent, Annie Hicks, Ruth Thorney, Rose Johnson. These mothers worked with local preachers and churches to challenge school segregation in the 1960's, advocating for better educational opportunities for their children. ",Lucille Rutherford; West Concord Mothers; Ruth Forney; Transportation; Olive Hill High School; Mountain View Elementary; Morganton High School; Glen Alpine; Slades Chapel; sports; children; Mountain View Recreation Center; Burkemont Hotel; oral history; primary source,"West Concord Street, Morganton, North Carolina",35.75061105178484,-81.69357970793953,True,History Museum of Burke County,rutherford,record,compound_object,eng,"In Copyright - Educational Use Permitted. For more information, please contact Morganton Public Library North Carolina Room (828) 764-9266.",http://rightsstatements.org/vocab/InC-EDU/1.0/,transcript,https://www.youtube.com/watch?v=0Q4Tf7CeI-c,,https://img.youtube.com/vi/0Q4Tf7CeI-c/hqdefault.jpg,,
forney,,Interview with Charles Forney,,Claude Sitton; History Museum of Burke County,History Museum of Burke County,2015-10-01,,"Charles Forney was born in Morganton and attended first and second grade at Olive Hill School. Mountain View Elementary School opened in 1957, and Forney transferred there. His family lived on West Concord Street, and his parents were involved in organizing among West Concord families to have their children transferred to the all-white schools in their neighborhoods. His mother Ruth Forney was part of the Seven Mothers. Because of his families’ efforts, Forney was among the first wave of Black students to desegregate public schools. In 1963, he transferred to Morganton Junior High, a formerly all-white school. ",Charles Forney; desegregation; sports; school integration; racial violence; oral history; primary source,"Morganton, North Carolina",35.73679724,-81.69177026,false,History Museum of Burke County,forney,record,compound_object,eng,"In Copyright - Educational Use Permitted. For more information, please contact Morganton Public Library North Carolina Room (828) 764-9266.",http://rightsstatements.org/vocab/InC-EDU/1.0/,transcript,https://www.youtube.com/watch?v=DH8dV7oK4-8,,https://img.youtube.com/vi/DH8dV7oK4-8/hqdefault.jpg,,
bryant,,Interview with Elias Bryant,,Claude Sitton; Allen Fullwood; History Museum of Burke County,History Museum of Burke County,2015-09-09,,"Elias Bryant attended MacAlpine Elementary School and Olive Hill High School for most of his high school years. During his senior year in 1964-1965, due to desegregation he was reassigned to Glen Alpine High School. On his first day at Glen Alpine High School, the principal sent white students to one side of the gym and Black students to the other and addressed Black students using a racial epithet. ",Elias Bryant; Alan Fullwood; Glen Alpine Elementary School; Olive Hill High School; Glen Alpine; desegregation; school integration; oral history; Hush Puppy Fish Camp; primary source,"Morganton, North Carolina",35.73679724,-81.69177026,false,History Museum of Burke County,bryant,record,compound_object,eng,"In Copyright - Educational Use Permitted. For more information, please contact Morganton Public Library North Carolina Room (828) 764-9266.",http://rightsstatements.org/vocab/InC-EDU/1.0/,transcript,https://www.youtube.com/watch?v=A6DtIH2SEgU,,https://img.youtube.com/vi/A6DtIH2SEgU/hqdefault.jpg,,
mcintosh,,Interview with William F. McIntosh and Robert Caldwell,,Claude Sitton; History Museum of Burke County,History Museum of Burke County,2012-01-05,,Reverend W.F. McIntosh and Robert Caldwell speak with Claude Sitton about their experiences of desegregation in Burke County schools.,desegregation; oral history; Burke County,"Morganton, North Carolina",35.73679724,-81.69177026,True,History Museum of Burke County,mcintosh,record,compound_object,eng,"In Copyright - Educational Use Permitted. For more information, please contact Morganton Public Library North Carolina Room (828) 764-9266.",http://rightsstatements.org/vocab/InC-EDU/1.0/,transcript,https://www.youtube.com/watch?v=fQUZWEUS9-M,,https://img.youtube.com/vi/fQUZWEUS9-M/hqdefault.jpg,,
slades-chapel,,Slades Chapel AME Zion Church,,,Children of the Struggle Project,,,Slades Chapel AME Zion Church located at 307 East Union Street. A central gathering place for the African American community and important site for civil rights organizing in Burke County. The West Concord Mothers met here to plan their desegregation efforts in the 1960s.,Slades Chapel; church; civil rights; West Concord Mothers; organizing; place; African American community,"307 East Union Street, Morganton, North Carolina",35.7454,-81.6848,True,Children of the Struggle Project,slades-chapel,place,image/jpg,eng,"In Copyright - Educational Use Permitted. For more information, please contact Morganton Public Library North Carolina Room (828) 764-9266.",http://rightsstatements.org/vocab/InC-EDU/1.0/,image,/objects/slades-chapel-marker.jpg,,/objects/slades-chapel-marker.jpg,,
olive-hill-high-school,,Olive Hill High School,,,Children of the Struggle Project,,,Olive Hill High School was the segregated high school for African American students in Morganton. The school served the Black community until desegregation led to its closure.,Olive Hill High School; education; segregation; desegregation; place; African American community,"Morganton, North Carolina",35.735015,-81.690856,True,Children of the Struggle Project,olive-hill-high-school,place,image/jpg,eng,"In Copyright - Educational Use Permitted. For more information, please contact Morganton Public Library North Carolina Room (828) 764-9266.",http://rightsstatements.org/vocab/InC-EDU/1.0/,image,/objects/olive_hill_hs_yearbook.jpg,,/objects/olive_hill_hs_yearbook.jpg,,
mountain-view-elementary,,Mountain View Elementary School,,,Children of the Struggle Project,,,Mountain View Elementary School opened in 1958 as a segregated elementary school for African American students. It served grades one through eight until desegregation in 1965. The school was a center of the Black community in Morganton.,Mountain View Elementary; education; segregation; desegregation; place; African American community,"Morganton, North Carolina",35.753476987977706,-81.70172887755979,True,Children of the Struggle Project,mountain-view-elementary,place,image/jpg,eng,"In Copyright - Educational Use Permitted. For more information, please contact Morganton Public Library North Carolina Room (828) 764-9266.",http://rightsstatements.org/vocab/InC-EDU/1.0/,image,/objects/class-photo.jpg,,/objects/class-photo.jpg,,
forest-hill-elementary,,Forest Hill Elementary School,,,Children of the Struggle Project,,,Forest Hill Elementary School was one of the formerly all-white schools that Black students were reassigned to during the first wave of desegregation in 1963. Students experienced isolation and discrimination at this school.,Forest Hill Elementary; education; desegregation; place; white schools,"Morganton, North Carolina",35.73242954104869,-81.7010763122796,True,Children of the Struggle Project,forest-hill-elementary,place,image/jpg,eng,"In Copyright - Educational Use Permitted. For more information, please contact Morganton Public Library North Carolina Room (828) 764-9266.",http://rightsstatements.org/vocab/InC-EDU/1.0/,image,/objects/slades-chapel-marker.jpg,,/objects/slades-chapel-marker.jpg,,
glen-alpine-elementary,,Glen Alpine Elementary School,,,Children of the Struggle Project,,,Glen Alpine Elementary School was a formerly all-white school in Glen Alpine that Black students were reassigned to during desegregation. Students faced significant challenges and discrimination during the integration process.,Glen Alpine Elementary; education; desegregation; place; Glen Alpine; white schools,"Glen Alpine, North Carolina",35.72546731639418,-81.77920292184646,True,Children of the Struggle Project,glen-alpine-elementary,place,image/jpg,eng,"In Copyright - Educational Use Permitted. For more information, please contact Morganton Public Library North Carolina Room (828) 764-9266.",http://rightsstatements.org/vocab/InC-EDU/1.0/,image,/objects/slades-chapel-marker.jpg,,/objects/slades-chapel-marker.jpg,,
freedom-high-school,,Freedom High School,,,Children of the Struggle Project,,,Freedom High School opened in 1973-1974 as a new integrated high school in Burke County. The school brought together students from formerly segregated schools and represented a new era in education following desegregation.,Freedom High School; education; desegregation; integration; place,"Morganton, North Carolina",35.74474713178156,-81.71971823816976,True,Children of the Struggle Project,freedom-high-school,place,image/jpg,eng,"In Copyright - Educational Use Permitted. For more information, please contact Morganton Public Library North Carolina Room (828) 764-9266.",http://rightsstatements.org/vocab/InC-EDU/1.0/,image,/objects/slades-chapel-marker.jpg,,/objects/slades-chapel-marker.jpg,,
west-concord-street,,West Concord Street,,,Children of the Struggle Project,,,Home to the Seven Mothers who organized for desegregation of Burke County public schools in the 1960s.,West Concord Street; West Concord Mothers; civil rights; organizing; place,"Morganton, North Carolina",35.74007037157964,-81.69034274462378,True,Children of the Struggle Project,west-concord-street,place,image/jpg,eng,"In Copyright - Educational Use Permitted. For more information, please contact Morganton Public Library North Carolina Room (828) 764-9266.",http://rightsstatements.org/vocab/InC-EDU/1.0/,image,/objects/slades-chapel-marker.jpg,,/objects/slades-chapel-marker.jpg,,
